527,5,Chovsourir,Psy,Vol,,,Base,Il vit dans les forêts sombres et les grottes. Il émet des ultrasons par le nez pour se diriger.,
528,5,Rhinolove,Psy,Vol,,,Niveau 1,Il émet des ondes sonores de différentes fréquences par le nez. Certaines peuvent briser des rochers.,
529,5,Rototaupe,Sol,,,,Base,Il peut creuser à plus de 50km/h et faire la course avec une voiture roulant sur le terrain qu'il creuse.,
530,5,Minotaupe,Sol,Acier,,,Niveau 1,Ses vrilles en acier peuvent transpercer des poutres en fer. Il est très employé dans la construction de tunnels.,
531,5,Nanméouïe,Normal,,1,,Base,Il ausculte les gens avec ses antennes auriculaires pour juger de leurs émotions ou de leur santé.,
532,5,Charpenti,Combat,,,,Base,"Il combat avec une poutre. Quand il en arrive à transporter de lourds madriers sans problème, l'évolution est proche.",
533,5,Ouvrifier,Combat,,,,Niveau 1,Même une armée de catcheurs se jetant sur son corps hyper musclé ne le ferait pas ciller.,
534,5,Bétochef,Combat,,,,Niveau 2,On pense que la recette du ciment a été enseignée aux humains par un Bétochef il y a 2 000 ans.,
535,5,Tritonde,Eau,,,,Base,Il prévient ses camarades du danger en faisant vibrer ses joues pour générer un signal d'alarme très aigu.,
536,5,Batracné,Eau,Sol,,,Niveau 1,"Quand il fait vibrer la bosse sur sa tête, il provoque des ondulations dans l'eau, mais aussi des tremblements de terre.",
537,5,Crapustule,Eau,Sol,,,Niveau 2,"Il fait gicler un liquide paralysant des pustules sur sa tête, et attaque ses ennemis à coups de vibrations.",
538,5,Judokrak,Combat,,,,Base,"Quand il noue sa ceinture, il devient plus puissant. Les Judokrak sauvages tressent leur ceinture avec des lianes.",
539,5,Karaclée,Combat,,,,Base,"Dans les montagnes où il s'entraîne, on peut l'entendre donner des coups de poings aux rochers et aux grands arbres.",
540,5,Larveyette,Insecte,Plante,,,Base,Il fait des vêtements en découpant des feuilles et en les cousant avec le fil adhésif qu'il sécrète par la bouche.,
541,5,Couverdure,Insecte,Plante,,,Niveau 1,"Dans les forêts où il vit, la végétation pousse bien car il transforme les feuilles mortes en engrais.",
542,5,Manternel,Insecte,Plante,,,Niveau 2,"Quand il trouve de petits Pokémon, il leur coud des vêtements de feuilles en utilisant ses coupoirs et son fil adhésif.",
543,5,Venipatte,Insecte,Poison,,,Base,"Sa morsure est très venimeuse. Elle paralyse même les grands Pokémon Oiseaux, ses prédateurs.",
544,5,Scobolide,Insecte,Poison,,,Niveau 1,"Protégé par sa solide carapace, il fonce sur ses ennemis en roulant comme un pneu.",
545,5,Brutapode,Insecte,Poison,,,Niveau 2,Il accule l'ennemi par ses mouvements rapides et l'attaque avec ses cornes. Il ne s'arrête qu'au coup de grâce.,
546,5,Doudouvet,Plante,Fée,,,Base,"Si on l'attaque, il projette un nuage de coton. L'ennemi le confond avec lui, ce qui lui permet de s'enfuir.",
547,5,Farfaduvet,Plante,Fée,,,Niveau 1,"Il se faufile comme le vent par les espaces les plus étroits, en laissant une touffe de poils blancs.",
548,5,Chlorobule,Plante,,,,Base,"Les feuilles sur sa tête sont très amères, mais elles remettent d'aplomb les corps les plus éreintés.",
549,5,Fragilady,Plante,,,2,Niveau 1,Même les Dresseurs confirmés ont du mal à faire éclore sa belle fleur. Un Pokémon apprécié des célébrités.,
550,5,Bargantua,Eau,,,3,Base,Les bleus et les rouges se détestent cordialement et se battent dès qu'ils s'aperçoivent. Un Pokémon très violent.,
551,5,Mascaïman,Sol,Ténèbres,,,Base,Il vit dans le sable des déserts. Le sable chauffé par le soleil empêche son corps de refroidir.,
552,5,Escroco,Sol,Ténèbres,,,Niveau 1,Ils vivent en petits groupes. La membrane qui couvre leurs yeux les protège du soleil.,
553,5,Crocorible,Sol,Ténèbres,,,Niveau 2,Il ne laisse jamais échapper ses proies. Ses mâchoires surpuissantes peuvent broyer une voiture.,
554,5,Darumarond,Feu,,,2,Base,"Quand le feu brûle dans son corps, il est tout excité et court partout. Quand le feu s'apaise, il s'endort.",
555,5,Darumacho,Feu,,,4,Niveau 1,Il entretient des flammes à 1 400 °C dans son corps. De quoi détruire un camion-benne d'un coup de poing !,
556,5,Maracachi,Plante,,,,Base,"Avec une danse et des sons saccadés, il fait fuir ses prédateurs, les Pokémon Oiseaux dévoreurs de graines de fleur.",
557,5,Crabicoque,Insecte,Roche,,,Base,Il peut facilement creuser son trou dans les pierres les plus dures grâce au liquide sécrété par sa bouche.,
558,5,Crabaraque,Insecte,Roche,,,Niveau 1,"Entre eux, les querelles de territoire sont fréquentes et violentes. Celui qui se fait briser son rocher a perdu.",
559,5,Baggiguane,Ténèbres,Combat,,,Base,Il remonte sa peau jusqu'à son cou pour se protéger. Elle a une constitution élastique qui absorbe les coups.,
560,5,Baggaïd,Ténèbres,Combat,,,Niveau 1,Ils se regroupent pour rosser ceux qui pénètrent sur leur territoire. Ils crachent un venin corrosif.,
561,5,Cryptéro,Psy,Vol,,,Base,On dit qu'il parcourt toujours le même itinéraire parce qu'il a gardé la mémoire de la ville antique qu'il protégeait.,
562,5,Tutafeh,Spectre,,,2,Base,"Le motif de son masque est son visage quand il était humain. Parfois, il le regarde et se met à pleurer.",
563,5,Tutankafer,Spectre,,,,Niveau 1,Il paraît qu'il avale les gens et les transforme en momies. Il adore manger des lingots d'or.,
564,5,Carapagos,Eau,Roche,,,Base,Il a été recréé à partir d'un fossile préhistorique. Il peut plonger jusqu'à 1 000 mètres de profondeur.,
565,5,Mégapagos,Eau,Roche,,,Niveau 1,Il vit sur terre et en mer. Ses bras surpuissants peuvent percer des trous dans la coque des paquebots.,
566,5,Arkéapti,Roche,Vol,,,Base,On dit qu'il serait l'ancêtre de tous les Pokémon Oiseaux. Il ne sait pas voler et se déplace en sautant d'arbre en arbre.,
567,5,Aéroptéryx,Roche,Vol,,,Niveau 1,Il s'envole après avoir pris de l'élan. Il est assez intelligent pour chasser ses proies en groupe.,
568,5,Miamiasme,Poison,,,,Base,Il aime les endroits mal tenus. Le gaz qu'il rote endort pendant une semaine.,
569,5,Miasmax,Poison,,,,Niveau 1,"Méfiez-vous du poison qu'il projette de son bras droit, sans quoi ses toxines non identifiées vous feront passer un sale quart d'heure.",
570,5,Zorua,Ténèbres,,,2,Base,"À cause de sa timidité, il aurait développé la capacité de changer son apparence.",
571,5,Zoroark,Ténèbres,,,2,Niveau 1,"Les humains qui osent menacer son habitat finissent par errer éternellement dans les bois, victimes de ses illusions.",
572,5,Chinchidou,Normal,,,,Base,Il faut bien une journée entière pour laver sa queue après s'en être servi pour faire le ménage dans son nid et épousseter son corps.,
573,5,Pashmilla,Normal,,,,Niveau 1,Le liquide que son corps sécrète est étrangement huileux. C'est un remède efficace pour les personnes qui ont la peau sèche.,
574,5,Scrutella,Psy,,,,Base,"Parfois, ce Pokémon chuchote alors qu'il n'y a personne aux alentours. On raconte qu'il parle à une entité que personne ne peut voir.",
575,5,Mesmérella,Psy,,,,Niveau 1,On raconte qu'il enlève les enfants endormis pendant les nuits étoilées. Cela lui vaut d'être considéré comme un démon punisseur.,
576,5,Sidérella,Psy,,,,Niveau 2,"Il prédit l'avenir à partir du mouvement des étoiles. Il dispose de grands pouvoirs psychiques, mais il n'est pas de nature hostile.",
577,5,Nucléos,Psy,,,,Base,On raconte que le curieux fluide qui entoure le corps de ce Pokémon lui permet de survivre dans l'espace.,
578,5,Méios,Psy,,,,Niveau 1,"Étant donné que ses deux cerveaux sont rarement sur la même longueur d'onde, il est impossible de prédire son comportement.",
579,5,Symbios,Psy,,,,Niveau 2,"Fier d'avoir des bras, il préfère s'en servir pour assommer ses adversaires plutôt que d'avoir recours à ses pouvoirs psychiques.",
580,5,Couaneton,Eau,Vol,,,Base,"Un Pokémon Oiseau doué pour la plongée. Il nage sous l'eau à la rechercher de sphaigne, son plat préféré.",
581,5,Lakmécygne,Eau,Vol,,,Niveau 1,"Un Pokémon gracieux, mais aussi robuste. Il peut voler des milliers de kilomètres grâce à ses ailes puissantes.",
582,5,Sorbébé,Glace,,,,Base,Son souffle glacé descend jusqu’à -50 °C. Il fond peu à peu quand il se retrouve dans un endroit chaud.,
583,5,Sorboul,Glace,,,,Niveau 1,Ce robuste Pokémon a survécu à l’ère glaciaire. Il est extrêmement populaire dans les régions chaudes.,
584,5,Sorbouboul,Glace,,,,Niveau 2,"Lorsqu'il a les nerfs en boule, il provoque un blizzard qui gèle tout le monde, alliés comme adversaires.",
585,5,Vivaldaim,Normal,Plante,,4,Base,Ce Pokémon change d'aspect en fonction des saisons.,
586,5,Haydaim,Normal,Plante,,4,Niveau 1,"Ces Pokémon changent de forme en fonction des saisons. D'ordinaire, on ne les voit que sous une seule forme à la fois, mais dans la Forêt Sibylline, il est possible de voir les quatre coexister !",
587,5,Emolga,Electrique,Vol,,,Base,"Les baies sucrées sont son pêché mignon. Il lui arrive d'en conserver beaucoup trop dans ses bajoues, ce qui l'empêche de bien planer.",
588,5,Carabing,Insecte,,,,Base,Il crache un liquide qui dissout les coquilles des Escargaume pour se régaler de leur contenu.,
589,5,Lançargot,Insecte,Acier,,,Niveau 1,Il charge ses ennemis en brandissant ses lances.,
590,5,Trompignon,Plante,Poison,,,Base,On ignore toujours l'origine ou la signification de sa forte ressemblance avec une Poké Ball.,
591,5,Gaulet,Plante,Poison,,,Niveau 1,"Ce Pokémon a tendance à très peu se déplacer. Quand il voit une Poké Ball abandonnée au sol, il reste immobile à côté.",
592,5,Viskuse,Eau,Spectre,,2,Base,"Il enroule ses membres en forme de voiles autour de ses proies, puis les entraîne dans les abysses.",
593,5,Moyade,Eau,Spectre,,2,Niveau 1,"On le trouve souvent près des bateaux de croisière et des pétroliers, où il cherche des proies à entraîner dans les abysses.",
594,5,Mamanbo,Eau,,,,Base,On pense qu'il protège les Pokémon affaiblis parce qu'il partage avec eux les mêmes prédateurs.,
595,5,Statitik,Insecte,Electrique,,,Base,Il s'accroche aux autres Pokémon pour aspirer leur électricité statique. On en trouve souvent collés au postérieur de Voltoutou.,
596,5,Mygavolt,Insecte,Electrique,,,Niveau 1,Il attaque en projetant les poils de son abdomen chargés en électricité. La victime reste alors paralysée pendant trois jours et trois nuits.,
597,5,Grindur,Plante,Acier,,,Base,Il aime les grottes pleines de mousse. Les enzymes contenues dans ces plantes l'aident à obtenir des épines grandes et solides.,
598,5,Noacier,Plante,Acier,,,Niveau 1,Il fissure la roche avec ses épines pour ensuite absorber les nutriments qui s'y trouvent grâce à l'extrémité de ses tentacules.,
599,5,Tic,Acier,,,,Base,"Les humains auraient inventé les mécanismes à engrenages il y a fort longtemps, en observant ce Pokémon.",
600,5,Clic,Acier,,,,Niveau 1,Ce Pokémon symbolisant la technologie industrielle est souvent utilisé dans le logo des entreprises de Galar.,
601,5,Cliticlic,Acier,,,,Niveau 2,Il peut envoyer de terribles décharges électriques de la pointe de ses pics. Il accumule de grandes quantités d'énergie dans son noyau rouge.,
602,5,Anchwatt,Electrique,,,,Base,Ils agissent en groupes. Ils possèdent un organe produisant de l'électricité et lancent des décharges en cas de danger.,
603,5,Lampéroie,Electrique,,,,Niveau 1,Les taches rondes émettent de l'électricité. Il s'enroule autour de ses proies et les électrocute.,
604,5,Ohmassacre,Electrique,,,,Niveau 2,Il peut sortir de l'eau à la force de ses bras pour attraper des proies sur la rive. Il retourne à l'eau en un instant.,
605,5,Lewsor,Psy,,,,Base,"Ce Pokémon est nimbé de mystère. On raconte qu'il serait apparu il y a 50 ans, après la chute d'un OVNI",
606,5,Neitram,Psy,,,,Niveau 1,"Il peut modifier les souvenirs avec ses pouvoirs psychiques. Vous ne le savez pas encore, mais vous avez peut-être déjà tout oublié...",
607,5,Funécire,Spectre,Feu,,,Base,"Son corps est tiède, réchauffé par sa flamme. Il prend les personnes égarées par la main et les guide vers le monde des esprits.",
608,5,Mélancolux,Spectre,Feu,,,Niveau 1,"Comme il apparaît dès qu'une personne est sur le point de trépasser, les gens le craignent et le prennent pour un messager de la mort.",
609,5,Lugulabre,Spectre,Feu,,,Niveau 2,"Il s'installe dans les résidences anciennes. Pour hypnotiser son adversaire, il agite les flammes de ses bras de manière inquiétante.",
610,5,Coupenotte,Dragon,,,,Base,Il vit dans des terriers qu'il creuse à même le sol et organise des concours avec ses camarades pour voir qui peut briser la Baie la plus dure.,
611,5,Incisache,Dragon,,,,Niveau 1,"Une fois cassés, ses crocs ne repoussent pas. Après les combats, il les aiguise avec soin sur les pierres d'un ruisseau.",
612,5,Tranchodon,Dragon,,,,Niveau 2,"D’un naturel doux, il est cependant redoutable lorsqu’il se fâche. Il est très fier de ses crocs qui peuvent même découper des poutres d’acier.",
613,5,Polarhume,Glace,,,,Base,Il renifle avant d’utiliser une capacité. Le froid intense contenu dans sa morve lui permet de lancer ces capacités,
614,5,Polagriffe,Glace,,,,Niveau 1,"D'un caractère un peu brutal, ils sont constamment en conflit territorial avec les Mammochon",
615,5,Hexagel,Glace,,,,Base,"Lorsqu'il fait trop chaud, il s'évapore, ce qui explique pourquoi on ne le voit presque pas en été.",
616,5,Escargaume,Insecte,,,,Base,Il se recroqueville dans sa carapace en fermant la visière lorsque des ennemis approchent.,
617,5,Limaspeed,Insecte,,,,Niveau 1,Il se bat avec célérité en projetant du poison. Il est si cool qu'il est souvent le héros de films ou de bandes dessinées à succès.,
618,5,Limonde,Sol,Electrique,,2,Base,"Lorsque les parties jaunes de son corps envoient une puissante décharge électrique, il ébauche un sourire. Personne ne sait pourquoi.",
619,5,Kungfouine,Combat,,,,Base,Il s'isole en montagne pour s'entraîner avec ses congénères. Les techniques de coups de pied ou de poing changent d'une meute a l'autre.,
620,5,Shaofouine,Combat,,,,Niveau 1,"Il accule son ennemi avec une rafale d’attaques fulgurantes, puis concentre son énergie pour lui donner le coup de grâce.",
621,5,Drakkarmin,Dragon,,,,Base,La peau rouge de sa gueule est dure comme le roc. Il accule ses ennemis dans les boyaux des cavernes et les attaque à coups de tête.,
622,5,Gringolem,Sol,Spectre,,,Base,Ce Pokémon très ancien a été façonné avec de l'argile. On ne sait pourquoi certains spécimens n'ont de cesse d'aligner de grosses pierres.,
623,5,Golemastoc,Sol,Spectre,,,Niveau 1,"Son énergie viendrait d'un mécanisme à mouvement perpétuel interne, mais jusqu'à présent, personne n'en a la preuve.",
624,5,Scalpion,Ténèbres,,,,Base,"Après avoir dépecé ses ennemis, il va sur les berges pour aiguiser ses lames sur une pierre.",
625,5,Scalproie,Ténèbres,Acier,,,Niveau 1,Sa recherche des meilleurs endroits où trouver des pierres pour affûter ses lames le conduit souvent à affronter des Incisache,
626,5,Frison,Normal,,,,Base,"Il peut détruire une voiture d'un coup de tête. Plus sa crinière est volumineuse, plus son rang au sein du troupeau est élevé.",
627,5,Furaiglon,Normal,Vol,,,Base,C'est un guerrier endurci dès sa naissance. Il commence d'ailleurs par défier ses parents au combat pour leur prouver sa valeur.,
628,5,Gueriaigle,Normal,Vol,,2,Niveau 1,"Rien n'effraie cet intrépide Pokémon, pas même la mort. Jadis, les gens d'Alola le surnommaient « le preux chevalier du ciel » avec respect.",
629,5,Vostourno,Ténèbres,Vol,,,Base,Il protège son tendre popotin avec le crâne d'une de ses proies. Il en change régulièrement en grandissant,
630,5,Vaututrice,Ténèbres,Vol,,,Niveau 1,"Il tournoie, haut dans le ciel, à la recherche d'un Pokémon affaibli. Sa proie favorite est le petit Osselait.",
631,5,Aflamanoir,Feu,,,,Base,Il fait fondre peu à peu l’exosquelette des Fermite pour se délecter de leur chair.,
632,5,Fermite,Insecte,Acier,,,Base,Sa grande mâchoire réduit même les rochers en miettes.,
633,5,Solochi,Ténèbres,Dragon,,,Base,Il mord d'abord et réfléchit ensuite. On dit qu'il n'oublie jamais l'odeur de la nourriture qu'il aime,
634,5,Diamat,Ténèbres,Dragon,,,Niveau 1,"Il est toujours couvert de blessures, même s'il n'a affronté personne.",
635,5,Trioxhydre,Ténèbres,Dragon,,,Niveau 2,Il dévore tout ce qui bouge. Bon nombre de légendes mentionnent des villages entiers rasés,
636,5,Pyronille,Insecte,Feu,,,Base,"Il se sert de flammes pour se défendre. Jadis, les anciens pensaient qu'il nichait dans le soleil.",
637,5,Pyrax,Insecte,Feu,,,Niveau 1,Il décrit des cercles dans le ciel en faisant pleuvoir des écailles enflammées. Il était jadis surnommé « le courroux solaire ».,
638,5,Cobaltium,Acier,Combat,,,Base,Il possède un corps et un cœur de fer. Il peut mater les Pokémon les plus agressifs d'un simple regard.,L
639,5,Terrakium,Roche,Combat,,,Base,Il possède un pouvoir incommensurable. Il se montre impitoyable envers ceux qui s'en prennent aux petits Pokémon.,L
640,5,Viridium,Plante,Combat,,,Base,"Rapide comme le vent, il s'abat tel un tourbillon sur ses ennemis avant de les transpercer sans pitié de ses cornes acérées.",L
641,5,Boréas,Vol,,,2,Base,L'énergie dégagée par sa queue provoque d'énormes tempêtes dont la force peut renverser des maisons.,L
642,5,Fulguris,Electrique,Vol,,2,Base,Les terres qu'il a survolées sont recouvertes d'innombrables traces des éclairs qu'il y a fait tomber.,L
643,5,Reshiram,Dragon,Vol,,,Base,Un Pokémon assez puissant pour embraser le monde entier. Il soutient les défenseurs de la Réalité,L
644,5,Zekrom,Dragon,Electrique,,,Base,Un Pokémon assez puissant pour foudroyer le monde entier. Il soutient ceux qui suivent leur Idéal.,L
645,5,Démétéros,Sol,Vol,,2,Base,Il utilise l'énergie qu'il tire du vent et de la foudre pour enrichir les sols en nutriments pour les cultures.,L
646,5,Kyurem,Dragon,Glace,,3,Base,Il se serait congelé lui-même avec son souffle glacé pour stabiliser sa structure cellulaire.,L
647,5,Keldeo,Eau,Combat,,2,Base,"Lorsqu'il livre un combat difficile, la corne sur son front se renforce et se développe, ce qui éveillerait sa véritable puissance.",F
648,5,Meloetta,Normal,Psy,,2,Base,Sa voix si particulière lui permet de chanter des mélodies qui ensorcellent les gens et modifient leurs émotions.,F
649,5,Genesect,Insecte,Acier,,5,Base,"Un Pokémon existant depuis 300 millions d'années, et modifié par la Team Plasma.",F
650,6,Marisson,Plante,,,,Base,"Lorsqu’il rassemble ses forces, les piquants souples qui recouvrent sa tête deviennent si durs et acérés qu’ils pourraient transpercer un rocher.",
651,6,Boguérisse,Plante,,,,Niveau 1,"Il renforce ses membres inférieurs en se ruant violemment sur ses congénères. Naturellement paisible, il ne provoque jamais un combat.",
652,6,Blindépique,Plante,Combat,,,Niveau 2,Il est si puissant qu’il pourrait renverser un char de 50 t d’un seul assaut. Il se sert de son corps comme d’un bouclier pour protéger ses alliés.,
653,6,Feunnec,Feu,,,,Base,"En cas de coup de fatigue, il grignote des rameaux pour recharger ses batteries. Ses oreilles dégagent une chaleur qui dépasse les 200°C",
654,6,Roussil,Feu,,,,Niveau 1,Il allume la branche plantée dans sa queue en la frottant contre son pelage et s'en sert au combat.,
655,6,Goupelin,Feu,Psy,,,Niveau 2,Peut prédire l'avenir s'il se concentre en fixant la flamme qui danse au bout de sa canne,
656,6,Grenousse,Eau,,,,Base,Sa poitrine et son dos sécrètent une mousse qui lui permet de subir moins de dégâts en amortissant le choc des attaques.,
657,6,Croâporal,Eau,,,,Niveau 1,Il est capable de lancer des pierres recouvertes de mousse avec une précision suffisante pour toucher une canette vide à 30 m.,
658,6,Amphinobi,Eau,Ténèbres,,2,Niveau 2,"Il transforme des jets d’eau sous pression en redoutables shuriken. Une fois lancés, ils tournent si vite qu’ils peuvent même couper le métal.",
659,6,Sapereau,Normal,,,,Base,"Il est sensible au danger. Lorsqu'il entend le battement d'ailes de Corvaillus, il creuse prestement un terrier et s'y cache.",
660,6,Excavarenne,Normal,Sol,,,Niveau 1,"Aussi puissant qu'une pelleteuse, il peut venir à bout de la roche la plus dure. On fait souvent appel à lui pour forer des tunnels.",
661,6,Passerouge,Normal,Vol,,,Base,"C'est un Pokémon affectueux et très facile à élever, mais une fois en situation de combat, il devient un adversaire implacable.",
662,6,Braisillon,Feu,Vol,,,Niveau 1,"Il crache des escarbilles par le bec, en visant sa proie. Une fois celle-ci capturée, il la fait rôtir avant de la déguster.",
663,6,Flambusard,Feu,Vol,,,Niveau 2,Il raffole des Goélise et des Picassaut. Il déstabilise ses proies d'un bon coup de patte avant de les capturer avec ses serres acérées.,
664,6,Lépidonille,Insecte,,,,Base,"Lorsqu’il est poursuivi par un Pokémon Oiseau, il projette une poudre noire qui paralyse tous ceux qu’elle touche.",
665,6,Pérégrain,Insecte,,,,Niveau 1,"Vit caché sous le couvert des buissons. Poursuivi par un ennemi, il tente de l’intimider en hérissant les poils qui lui couvrent le corps.",
666,6,Prismillon,Insecte,Vol,,20,Niveau 2,Ses ailes arborent différents motifs en fonction de son milieu.,
667,6,Hélionceau,Feu,Normal,,,Base,"Il est élevé avec ses congénères au sein de la troupe, mais dès qu’il peut chasser seul, il doit partir et vivre par ses propres moyens.",
668,6,Némélios,Feu,Normal,,2,Niveau 1,"Son souffle enflammé atteint les 6000°C, mais il ne l'utilise jamais contre ses proies. Il préfère en effet la viande crue.",
669,6,Flabébé,Fée,,,5,Base,Il confectionne la couronne qui orne sa tête en récoltant du pollen. Elle recèle de nombreuses propriétés curatives.,
670,6,Floette,Fée,,,6,Niveau 1,Il fait profiter ses fleurs de ses pouvoirs et met tout son cœur à leur entretien. Gare à ceux qui ravagent ses plates-bandes !,
671,6,Florges,Fée,,,5,Niveau 2,"Il peut vivre des centaines d'années, et consacre sa longue existence à l'entretien des jardins.",
672,6,Cabriolaine,Plante,,,,Base,Ce Pokémon paisible serait le premier à avoir jamais cohabité avec les humains.,
673,6,Chevroum,Plante,,,,Niveau 1,"Quand son Dresseur le tient par une corne, il est capable de deviner ses plus subtils changements d’humeur et de s’y adapter.",
674,6,Pandespiègle,Combat,,,,Base,"Il essaie à tout prix d'intimider son adversaire. S'il vous fait les gros yeux, faites-lui plaisir et prenez l'air apeuré !",
675,6,Pandarbare,Combat,Ténèbres,,,Niveau 1,Ce Pokémon féroce est très fier de ses gros bras. Beaucoup de Dresseurs l’apprécient pour son côté truculent.,
676,6,Couafarel,Normal,,,10,Base,"Sa fourrure pousse indéfiniment, mais il refuse de se faire couper la toison par une personne en qui il n'a pas confiance",
677,6,Psystigri,Psy,,,,Base,"Sous son masque inexpressif, il est en fait constamment en train d'essayer de contenir ses puissants pouvoirs psychiques",
678,6,Mistigrix,Psy,,,2,Niveau 1,"Les motifs en forme d'yeux, à l’intérieur de ses oreilles, sont la source de ses pouvoirs psychiques. La plupart du temps, il cache ces pouvoirs.",
679,6,Monorpale,Acier,Spectre,,,Base,"L'âme de ce pokemon est celle d'un humain qui a été tué il y a fort longtemps, par la même lame qui forme maintenant son corps.",
680,6,Dimoclès,Acier,Spectre,,,Niveau 1,Il s'est dédoublé en évoluant. Il intimide ses ennemis à grands coups de bruits métalliques,
681,6,Exagide,Acier,Spectre,,2,Niveau 2,"Grâce à son corps en acier et à sa barrière psychique, il peut se défendre en affaiblissant toutes sortes d'attaques.",
682,6,Fluvetin,Fée,,,,Base,Une douce odeur qui charme les gens émane de son corps. Les dames nobles raffolaient de lui.,
683,6,Cocotine,Fée,,,,Niveau 1,Un parfum capiteux émane constamment de sa fourrure. Ce parfum est si fort qu'il peut priver son Dresseur d'odorat.,
684,6,Sucroquin,Fée,,,,Base,Sa douce fourrure possède une odeur sucrée comme la barbe à papa. Il produit des filaments gluants pour empêtrer ses adversaires.,
685,6,Cupcanaille,Fée,,,,Niveau 1,Il peut diagnostiquer l'état de santé mentale et physique de quelqu'un rien qu'à l'odorat. Un tel don pourrait avoir des applications en médecine.,
686,6,Sepiatop,Ténèbres,Psy,,,Base,Il fait clignoter ses points lumineux à différentes fréquences pour échanger des informations avec ses congénères.,
687,6,Sepiatroce,Ténèbres,Psy,,,Niveau 1,Il manipule à sa guise ceux qui se sont laissé hypnotiser en observant son corps lumineux trop longtemps.,
688,6,Opermine,Roche,Eau,,,Base,"Il faut que les deux bras travaillent bien ensemble s'ils souhaitent survivre, sinon leur défense et leur attaque en souffre grandement.",
689,6,Golgopathe,Roche,Eau,,,Niveau 1,"Il scrute les environs avec les yeux de ses paumes. En cas d'urgence, ses membres peuvent prendre des initiatives pour triompher de l'ennemi.",
690,6,Venalgue,Poison,Eau,,,Base,"Il reste tapi au fond des océans, à l'abri des plus gros Pokémon. Il se nourrit principalement d'algues pourries.",
691,6,Kravarech,Poison,Dragon,,,Niveau 1,"Les étourdis qui divaguent du côté de chez lui se font chasser à grands jets de poison. Curieusement, il adore Sinistrail.",
692,6,Flingouste,Eau,,,,Base,"Sa pince, à la chair délicieuse, tombe parfois. Il se fait alors tout petit et se cache le temps qu’elle repousse.",
693,6,Gamblast,Eau,,,,Niveau 1,Il aspire de l'eau et la projette sous pression pour attaquer. Le jet est si puissant qu'il perce même d'épaisses plaques d'acier.,
694,6,Galvaran,Electrique,Normal,,,Base,Il absorbe les rayons du soleil en dépliant la peau de sa tête pour produire l’électricité nécessaire à ses puissantes capacités Électrik.,
