695,6,Iguolta,Electrique,Normal,,,Niveau 1,Il était révéré dans un royaume des sables aujourd’hui disparu. Il est arrivé à Galar dans une cargaison de pierres précieuses.,
696,6,Ptyranidur,Roche,Dragon,,,Base,Sa mâchoire géante est d'une puissance redoutable. Le Pokémon reconstitué serait légérement différent de son modèle antique.,
697,6,Rexillius,Roche,Dragon,,,Niveau 1,La reconstitution de Pokémon est un art imparfait. D’aucuns pensent même qu’il était en fait couvert d’une robe semblable à un plumage.,
698,6,Amagara,Roche,Glace,,,Base,"Il a été reconstitué, mais son corps n'est pas adapté aux températures actuelles, ce qui affecte probablement son espérance de vie.",
699,6,Dragmara,Roche,Glace,,,Niveau 1,La température de la surface de son corps est de -150 °C. Ce Pokémon est généralement très calme et très doux.,
700,6,Nymphali,Fée,,,,Niveau 1,"Une fois le combat entamé, il n'hésite pas une seconde, même contre un Pokémon de type Dragon dix fois plus gros que lui.",
701,6,Brutalibré,Combat,Vol,,,Base,"Il terrasse ses adversaires grâce à sa vitesse, mais il se pavane tant avant de lancer sa botte secrète qu'il se retrouve parfois en difficulté.",
702,6,Dedenne,Electrique,Fée,,,Base,Les moustaches du haut lui servent de capteurs pour inspecter son environnement,
703,6,Strassie,Roche,Fée,,,Base,"Il ne s'agit pas d'un Pokémon particulièrement rare, mais son allure strass et paillettes attire les gens.",
704,6,Mucuscule,Dragon,,,,Base,Ses cornes lui permettent d'inspecter les alentours. Elles sont si sensibles que tout son corps se fige si on les pince.,
705,6,Colimucus,Dragon,,,2,Niveau 1,"Comme il a du mal à distinguer ses alliés de ses proies, la faim peut parfois le pousser à asperger ses amis de son solvant.",
706,6,Muplodocus,Dragon,,,2,Niveau 2,"Ce Pokémon adore la compagnie humaine. Si son Dresseur ne lui donne pas assez d'amour, il pleure à grosses larmes visqueuses.",
707,6,Trousselin,Acier,Fée,,,Base,Il insère l'appendice situé sur sa tête dans les interstices en métal afin d'en extraire les ions,
708,6,Brocélôme,Spectre,Plante,,,Base,Il imite la voix d'un enfant pour inciter les gens à se perdre au plus profond des bois. Il espère ainsi se faire de nouveaux amis.,
709,6,Desséliande,Spectre,Plante,,,Niveau 1,On raconte que ce Pokémon mange tous ceux qui s'en prennent à sa forêt. Il est toutefois très gentil avec ses voisins sylvains.,
710,6,Pitrouille,Spectre,Plante,,,Base,Il peut manipuler les humains et les Pokémon en les hypnotisant grâce à la lumière qui filtre par les trous de son ventre,
711,6,Banshitrouye,Spectre,Plante,,4,Niveau 1,"Les soirs de pleine lune, il frappe aux portes des maisons. Si quelqu'un a le malheur de lui ouvrir, il l'emporte aussitôt dans l'au-delà.",
712,6,Grelaçon,Glace,,,4,Base,"Grâce à son souffle glacé à - 100 ° C, il peut geler l’humidité dans l’air et se façonner une carapace de glace.",
713,6,Séracrawl,Glace,,,2,Niveau 1,"Les crevasses sur son dos s'approfondissent au cours de la journée, mais se comblent de nouveau pendant la nuit.",
714,6,Sonistrelle,Vol,Dragon,,,Base,"Il adore les fruits et, en véritable gourmet, il ne mange que ceux qui sont bien mûrs. Il utilise ses ultrasons pour déterminer le degré de maturité.",
715,6,Bruyverne,Vol,Dragon,,,Niveau 1,"D'ordinaire violent, il vous mange littéralement dans la main si vous lui donnez des fruits mûrs, son mets favori.",
716,6,Xerneas,Fée,,,2,Base,On dit que ce Pokémon immortel peut offrir ses forces vitales. Il a été ranimé après avoir passé 1000 ans endormi sous la forme d'un arbre.,L
717,6,Yveltal,Ténèbres,Vol,,,Base,"Lorsque les plumes de sa queue et de ses ailes sont déployées et virent au rouge, ce Pokémon absorbe l'énergie vitale de ce qui l'entoure.",L
718,6,Zygarde,Dragon,Sol,,3,Base,"Ses griffes acérées déchirent ses adversaires. Il ne peut pas conserver cette forme longtemps, et se délite après un certain temps.",L
719,6,Diancie,Roche,Fée,1,,Base,"Il peut créer une multitude de diamants en un instant en serrant ses mains, simplement en compressant les molécules de carbone contenues dans l’air.",F
720,6,Hoopa,Psy,Spectre,,2,Base,Il possède une puissance considérable sous son apparence véritable. Une légende raconte qu'il désirait si fort un trésor caché dans un château qu'il déroba l'édifice tout entier.,F
721,6,Volcanion,Feu,Eau,,,Base,Il est capable de générer un nuage de vapeur pour se cacher. Il vit dans des montagnes inhabitées.,F
722,7,Brindibou,Plante,Vol,,,Base,"Ce Pokémon ne baisse jamais sa garde. Pendant la journée, il accumule de l'énergie par photosynthèse, pour mieux agir la nuit venue.",
723,7,Efflèche,Plante,Vol,,,Niveau 1,"Légèrement vaniteux, il aime prendre soin de ses ailes quand il en a le temps. Il refuse parfois de se battre si ses plumes sont trop sales.",
724,7,Archéduc,Plante,Vol,,2,Niveau 2,Les plumes de ses ailes lui servent de flèches. Sa précision au tir est si grande qu'il peut atteindre un gravillon à 100 m.,
725,7,Flamiaou,Feu,,,,Base,Les poils qu'il avale pendant sa toilette brûlent et forment une flamme dans son ventre. Celle-ci change selon sa façon dont il la recrache.,
726,7,Matoufeu,Feu,,,,Niveau 1,"Il porte à son cou une cloche de feu. Lorsqu'il crache des flammes, cette dernière se met à tinter bruyamment.",
727,7,Félinferno,Feu,Ténèbres,,,Niveau 2,"Un Pokémon brutal qui n'en fait qu'à sa tête. Selon son humeur du moment, il lui arrive d'ignorer sciemment les ordres de son Dresseur.",
728,7,Otaquin,Eau,,,,Base,"Connu pour son tempérament de battant, il rassemble l'eau de son corps au bout de son museau en un ballon qu'il projette sur l'ennemi.",
729,7,Otarlette,Eau,,,,Niveau 1,"Danseur hors-pair, il produit des ballons d'eau à la chaîne afin d'éclabousser l'adversaire lors d'un impitoyable ballet funeste.",
730,7,Oratoria,Eau,Fée,,,Niveau 2,"Il contrôle ses ballons d'eau par son chant, dont la mélodie, apprise auprès de ses semblables, se transmet de génération en génération.",
731,7,Picassaut,Normal,Vol,,,Base,Il creuse les arbres à raison de seize coups de bec par seconde. Le trou creusé lui sert ensuite à stocker des provisions ou à faire son nid.,
732,7,Piclairon,Normal,Vol,,,Niveau 1,"Il garde toujours dans son bec les pépins des fruits qu'il mange, ce qui lui permet de faire feu dès qu'un ennemi se présente.",
733,7,Bazoucan,Normal,Vol,,,Niveau 2,"Pendant le combat, son bec chauffe et dépasse allègrement les 100 °C. Ses adversaires repartent généralement avec de graves brûlures.",
734,7,Manglouton,Normal,,,,Base,"Avec ses crocs acérés, il ne peut s'empêcher de mordre tout ce qui bouge. Il fut introduit à Alola il y a longtemps, depuis une autre région.",
735,7,Argouste,Normal,,,,Niveau 1,"Lorsqu'il est sur les traces d'une proie, ce Pokémon n'est pas du genre à abandonner. Sauf le soir, lorsqu'il tombe de sommeil.",
736,7,Larvibule,Insecte,,,,Base,Il creuse l'écorce des arbres avec ses robustes mandibules pour en siroter la sève. Il vit en temps normal dans le sol.,
737,7,Chrysapile,Insecte,Electrique,,,Niveau 1,"Avec son corps capable de stocker l'électricité comme une batterie, il a déjà sauvé la mise à plus d'un campeur peu prévoyant.",
738,7,Lucanon,Insecte,Electrique,,,Niveau 2,"Il virevolte dans tous les sens, guettant la faille pour frapper. Il concentre l'électricité dans ses grandes mandibules pour foudroyer l'ennemi.",
739,7,Crabagarre,Combat,,,,Base,Il protège ses points faibles avec ses pinces en guettant le moment propice pour riposter. Il crache de l'écume lorsqu'il tombe K.O.,
740,7,Crabominable,Combat,Glace,,,Niveau 1,"l rêvait d'atteindre le sommet d'un pic enneigé, mais s'est égaré en chemin. Il a dû évoluer pour survivre au froid et a acquis un pelage fourni.",
741,7,Plumeline,Feu,Vol,,4,Base,"Il se charge en électricité en frottant ses plumes les unes contre les autres, puis s'approche de ses ennemis en dansant et les abat d'un coup.",
742,7,Bombydou,Insecte,Fée,,,Base,"Il se nourrit du nectar et du pollen des fleurs. Ayant la capacité de percevoir l'aura des choses, il sait quelles fleurs vont bientôt éclore.",
743,7,Rubombelle,Insecte,Fée,,,Niveau 1,"Il confectionne de petites boules de pollen de diverses natures, certaines lui servant de repas, d'autres à attaquer l'ennemi.",
744,7,Rocabot,Roche,,,,Base,"Comme il s'attache facilement à son Dresseur, on le conseille souvent aux débutants, bien qu'il ait tendance à devenir plus rebelle avec l'âge.",
745,7,Lougaroc,Roche,,,3,Niveau 1,"Il fait tourner en bourrique ses ennemis à cause de sa vitesse. Outre ses crocs et ses griffes, il peut compter sur le roc acéré de sa crinière.",
746,7,Froussardine,Eau,,,2,Base,"Quand il est dans le pétrin, ses yeux deviennent luisants. Ses semblables accourent alors et forment avec lui un banc de combat.",
747,7,Vorastérie,Poison,Eau,,,Base,Les épines sur sa tête transpercent et empoisonnent l'ennemi. Ses dix tentacules se chargent ensuite du reste.,
748,7,Prédastérie,Poison,Eau,,,Niveau 1,"Il arpente le fond des océans du haut de ses douze pattes, en laissant derrière lui une traînée de miettes de Corayon.",
749,7,Tiboudet,Sol,,,,Base,La boue qui lui colle aux pattes lui sert de semelle antidérapante. Il peut ainsi courir à toute allure avec vigueur et assurance.,
750,7,Bourrinos,Sol,,,,Niveau 1,"Une fois sèche, la boue qu'il crache reste solide même sous le vent et la pluie. Elle était autrefois très utilisée dans les revêtements muraux.",
751,7,Araqua,Eau,Insecte,,,Base,Il lui arrive d'aller chercher sa nourriture sur la terre ferme. Sa bulle lui sert alors aussi bien à respirer qu'à protéger sa tête molle.,
752,7,Tarenbulle,Eau,Insecte,,,Niveau 1,Il se bat en donnant des « coups de bulle ». Les plus petits Pokémon peuvent se retrouver piégés à l'intérieur de sa bulle et mourir noyés.,
753,7,Mimantis,Plante,,,,Base,"La journée, il passe son temps à flâner au soleil et à faire la sieste. Le soir venu, il part à la recherche d'un lieu plus sûr pour passer la nuit.",
754,7,Floramantis,Plante,,,,Niveau 1,Préserver ses couleurs éclatantes requiert un travail titanesque. On trouve tout de même des gens assez fous pour s'y atteler.,
755,7,Spododo,Plante,Fée,,,Base,Il répand des spores luminescentes qui clignotent autour de lui. Quiconque aperçoit ces lumières tombe dans un sommeil profond.,
756,7,Lampignon,Plante,Fée,,,Niveau 1,"Il est risqué de s'aventurer la nuit dans un bois peuplé de Lampignon. Attirés par leur lumière envoûtante, certains n'en sont jamais revenus.",
757,7,Tritox,Poison,Feu,,,Base,Il consume ses fluides corporels pour générer un gaz toxique qui étourdit ses ennemis. Il ne lui reste alors qu'à les achever.,
758,7,Malamandre,Poison,Feu,,,Niveau 1,"Curieusement, cette espèce ne compte que des femelles. Ces dernières aiment s'entourer de nombreux admirateurs Tritox mâles.",
759,7,Nounourson,Normal,Combat,,,Base,"Il est à croquer, sauf lorsqu'il s'énerve et frappe à tout va. Dans ce cas, laissez-le tranquille ou vous finirez à coup sûr dans le décor.",
760,7,Chelours,Normal,Combat,,,Niveau 1,"Sa force physique hors norme le rend assez dangereux. D'ailleurs, les zones qu'il habite sont systématiquement interdites d'accès.",
761,7,Croquine,Plante,,,,Base,"Une odeur terriblement appétissante émane du corps des Croquine. Alléchés, les Bazoucan rappliquent et les gobent goulûment.",
762,7,Candine,Plante,,,,Niveau 1,"Pour mieux se défendre, il a fait pousser sur son corps un calice assez solide pour résister aux coups de bec des Pokémon oiseaux.",
763,7,Sucreine,Plante,,,,Niveau 2,"Spécialiste du coup de pied bien placé, ce Pokémon prend un malin plaisir à savater ses ennemis au sol en riant aux éclats.",
764,7,Guérilande,Fée,,,,Base,Sa liane gluante diffuse des nutriments dans les fleurs qu'elle happe. Ces dernières dégagent alors un léger parfum.,
765,7,Gouroutan,Normal,Psy,,,Base,"Célébré pour son intelligence exceptionnelle, ce Pokémon vous prendra de haut si vous débutez. À réserver aux Dresseurs aguerris.",
766,7,Quartermac,Combat,,,,Base," Ils se rassemblent par groupes de vingt. Dans cette formation très soudée, nul ne songerait une seule seconde à abandonner ses alliés.",
767,7,Sovkipou,Insecte,Eau,,,Base," De nature poltronne, il prend ses nombreuses pattes à son cou au moindre danger et balaie le sol sur son passage.",
768,7,Sarmuraï,Insecte,Eau,,,Niveau 1, Il fait miroiter ses énormes griffes acérées avant d'attaquer. Elles sont assez puissantes pour fendre en deux l'air comme la mer.,
769,7,Bacabouh,Spectre,Sol,,,Base,Ceux qui ont le malheur de mettre la main dans sa gueule deviennent ses pantins. Il est prêt à tout pour agrandir son corps en forme de dune.,
770,7,Trépassable,Spectre,Sol,,,Niveau 1,"Il a possédé un humain pour que ce dernier le remodèle en château de sable, décuplant au passage ses pouvoirs de malédiction.",
771,7,Concombaffe,Eau,,,,Base," Il vit en bord de mer, ou en eaux peu profondes. Ses organes peuvent sortir de son corps pour saisir de la nourriture ou frapper l'ennemi.",
772,7,Type:0,Normal,,,,Base, Le lourd masque qu'il porte est un limiteur qui l'empêche d'exprimer toute l'étendue de sa puissance. Il recèle une force mystérieuse.,L
773,7,Silvallié,Normal,,,18,Base, La confiance qu'il place en son Dresseur a réveillé ses pouvoirs. Il est à présent capable de changer de type à loisir durant le combat.,L
774,7,Météno,Roche,Vol,,8,Base,"Il vivait dans la couche d'ozone, avant que sa carapace, devenue trop lourde, ne finisse par le faire chuter sur la terre ferme.",
775,7,Dodoala,Normal,,,,Base, Il rejoint et quitte ce monde en dormant. Son existence se déroule comme un rêve paisible. Il dort du sommeil du juste toute sa vie durant.,
776,7,Boumata,Feu,Dragon,,,Base,"Sa carapace est très instable. Si on la heurte par mégarde, elle explose. Le creux sur son ventre est son point faible.",
777,7,Togedemaru,Electrique,Acier,,,Base,"Les épines de ce Pokémon sont normalement baissées, mais quand il s'énerve, elles se dressent afin de pourfendre ses agresseurs.",
778,7,Mimiqui,Spectre,Fée,,2,Base,Sa véritable apparence est inconnue. Les chercheurs qui ont vu sous son déguisement sont littéralement morts de peur.,
779,7,Denticrisse,Eau,Psy,,,Base," Lorsqu'il utilise l'appendice sur sa tête pour projeter ses pouvoirs psychiques, il émet un bruit aussi irritant qu'un grincement de dents.",
780,7,Draïeul,Normal,Dragon,,,Base," C'est une bonne pâte de nature, mais si par malheur il s'énerve, il peut détruire tout ce qui l'entoure de son souffle puissant.",
781,7,Sinistrail,Spectre,Plante,,,Base,C'est une réincarnation de l'âme des algues. Son corps est formé de détritus marins qu'il enveloppe de limon.,
782,7,Bébécaille,Dragon,,,,Base, Il communique ses sentiments en frottant ses écailles. Les montagnes peuplées de Bébécaille bruissent d'un écho métallique.,
783,7,Écaïd,Dragon,Combat,,,Niveau 1, Il se jette sur ses proies en poussant un terrible cri de guerre. Il les déchiquette ensuite avec ses poings écaillés.,
784,7,Ékaïser,Dragon,Combat,,,Niveau 2,"Quand il voit un ennemi, il cherche à l'intimider en faisant sonner les écailles de sa queue. Les plus faibles perdent contenance et s'enfuient.",
785,7,Tokorico,Electrique,Fée,,,Base,"Gardien de Mele-Mele, il est curieux de tout. Il a le pouvoir d'appeler les nuages orageux pour stocker la foudre dans son corps.",L
786,7,Tokopiyon,Psy,Fée,,,Base,"Pokémon candide mais terriblement cruel, c'est le gardien d'Akala. Il puise son énergie dans le parfum entêtant des fleurs.",L
787,7,Tokotoro,Plante,Fée,,,Base, Il arrache de grands arbres et fait des moulinets avec. Il a le pouvoir de rendre la végétation luxuriante pour ensuite se nourrir de cette force.,L
788,7,Tokopisco,Eau,Fée,,,Base, Il confond ses ennemis grâce au brouillard et les pousse à s'en prendre à eux-mêmes. Il puise son énergie dans les courants marins.,L
789,7,Cosmog,Psy,,,,Base," Son corps est composé d'un gaz très volatile. Il croît lentement, en accumulant les poussières atmosphériques au gré de ses déplacements.",L
790,7,Cosmovum,Psy,,,,Niveau 1," On pourrait le croire mort car il ne bouge pas du tout. Au toucher, il reste tiède. On le surnomme ""cocon céleste"" depuis l'Antiquité.",L
791,7,Solgaleo,Psy,Acier,,,Niveau 2, Il viendrait d'un autre monde. Tout son corps émet une puissante lumière qui peut changer la nuit la plus noire en un jour radieux.,L
792,7,Lunala,Psy,Spectre,,,Niveau 2,"Cet être mystérieux viendrait d'un autre monde. Il absorbe continuellement la lumière, transformant le jour en nuit noire.",L
793,7,Zéroïd,Roche,Poison,,,Base," L'une des mystérieuses Ultra-Chimères. On l'aurait vue parasiter des gens en pleine rue, les rendant extrêmement violents.",U
794,7,Mouscoto,Insecte,Combat,,,Base, Personne ne sait si cette Ultra-Chimère venue d'un autre monde montre ses muscles pour être admirée ou pour intimider ceux qu'elle rencontre.,U
795,7,Cancrelove,Insecte,Combat,,,Base, L'une des Ultra-Chimères. On l'aurait aperçue en train de courir à une vitesse prodigieuse.,U
796,7,Câblifère,Electrique,,,,Base, L'une des mystérieuses Ultra-Chimères. On l'aurait vue émettre une formidable quantité d'électricité autour d'elle.,U
797,7,Bamboiselle,Acier,Vol,,,Base, Une Ultra-Chimère qui a traversé l'Ultra-Brèche. On l'aurait aperçue parcourir le ciel à grande vitesse.,U
798,7,Katagami,Plante,Acier,,,Base,"Une Ultra-Chimère venue de l'Ultra-Brèche. Elle ne semble pas agressive, bien que son corps tout entier soit une arme tranchante.",U
799,7,Engloutyran,Ténèbres,Dragon,,,Base, Une espèce d'Ultra-Chimère. On l'aurait aperçue dévorant des montagnes et des gratte-ciel.,U
800,7,Necrozma,Psy,,U,3,Base," Une créature endormie sous terre. On suppose qu'il s'agit d'une Ultra-Chimère et qu'elle serait venue d'un autre monde, il y a bien longtemps.",L
801,7,Magearna,Acier,Fée,,2,Base," Ce Pokémon a été créé de toutes pièces il y a 500 ans. Il comprend ce qu'on lui dit, mais il n'est pas doué de parole.",F
802,7,Marshadow,Combat,Spectre,,,Base, Il dissimule son apparence aux autres en se tapissant dans l'ombre. Son existence pourrait se révéler n'être qu'une fable.,F
803,7,Vémini,Poison,,,,Base,Cette Ultra-Chimère venue d'un autre monde ricane lorsqu'elle asperge ses proies de venin grâce au dard qu'elle a sur la tête.,U
804,7,Mandrillon,Poison,Dragon,,,Niveau 1,"Son corps contient des hectolitres de poison. Il fait partie de ces créatures que l'on nomme ""Ultra-Chimères"".",U
805,7,Ama-Ama,Roche,Acier,,,Base, Il est sorti d'une Ultra-Brèche. Il est composé de plusieurs petites entités qui s'assemblent pour n'en former qu'une seule.,U
806,7,Pierroteknik,Feu,Spectre,,,Base, Il s'approche des gens avec son allure désarticulée et fait subitement exploser sa tête. Ce serait une Ultra-Chimère.,U
807,7,Zeraora,Electrique,,,,Base," Il déchiquette son adversaire avec ses griffes chargées d’électricité. Même si sa cible évite l’attaque, elle reçoit un coup de jus.",F
808,7,Meltan,Acier,,,,Base,"Il se nourrit du métal qu'il fait fondre, et produit de l'énergie en faisant circuler du métal liquide dans son corps.",F
809,7,Melmetal,Acier,,,,Niveau 1,"On dit que, grâce à la force centrifuge, les coups de poing qu'il assène avec ses lourds écrous seraient les plus dévastateurs parmi les Pokémon.",F
810,8,Ouistempo,Plante,,,,Base,Il attaque en frappant frénétiquement avec son bâton. Son enthousiasme grandit à mesure que le rythme s'accélère.,
811,8,Badabouin,Plante,,,,Niveau 1,Ces pokemons qui parviennent à suivre le rythme le plus effréné avec leurs bâtons sont les plus respectés par leurs camarades.,
812,8,Gorythmic,Plante,,,,Niveau 2,Il contrôle le pouvoir de sa souche singulière en tapant en rythme dessus. Il se bat en manipulant des racines.,
813,8,Flambino,Feu,,,,Base,Il court pour augmenter sa température et faire circuler l'énergie incandescente dans son corps. Il peut ainsi déployer toute sa puissance.,
814,8,Lapyro,Feu,,,,Niveau 1,Son pelage épais lui permet de mieux résister au froid et d'augmenter la température de ses capacités Feu.,
815,8,Pyrobut,Feu,,,,Niveau 2,"Il drible avec des pierres pour en faire des ballons enflammés, avant de tirer sur ses adversaires pour les brûler.",
816,8,Larméléon,Eau,,,,Base,"Quand il a peur, il pleure des larmes contenant une substance lacrymogène d'une puissance équivalente à celle de cent oignons. ",
817,8,Arrozard,Eau,,,,Niveau 1,Il crée des bombes à eau grâce au liquide qu'il sécrète avec la paume de ses mains. Il s'en sert dans les combats où la stratégie prime.,
818,8,Lézargus,Eau,,,,Niveau 2,"Il repère le point faible de l'ennemi grâce à sa membrane nictitante, puis il transperce sa cible en tirant des jets d'eau à Mach 3 du bout des doigts",
819,8,Rongourmand,Normal,,,,Base,"On le trouve partout à Galar. S'il n'a pas de Baies en réserve dans ses deux joues, il devient anxieux.",
820,8,Rongrigou,Normal,,,,Niveau 1,"Il amasse tellement de Baies dans sa queue qu'elles tombent les unes après les autres, mais il est si étourdi qu'il ne s'en rend pas compte.",
821,8,Minisange,Vol,,,,Base,Ce Pokémon brave affronte même les adversaires les plus redoutables. Il devient plus fort à mesure qu'il subit les contre-attaques.,
822,8,Bleuseille,Vol,,,,Niveau 1,Il est capable d'utiliser des objets avec ses serres : il peut par exemple saisir et lancer des pierres ou même enrouler une corde autour d'un ennemi.,
823,8,Corvaillus,Vol,Acier,,,Niveau 2,Il n'a aucun rival dans le ciel de Galar. L'aspect intimidant de son corps d'acier noir et lustré inspire la crainte chez ses ennemis.,
824,8,Larvadar,Insecte,,,,Base,"Comme il passe tout son temps à recueillir des informations, son intelligence est très développée, mais sa force physique laisse à désirer.",
825,8,Coléodôme,Insecte,Psy,,,Niveau 1,"Il ne bouge presque pas, mais il est bien vivant. On dit qu'il aurait découvert ses pouvoirs psychiques à force de jeûner dans sa coquille.",
826,8,Astronelle,Insecte,Psy,,,Niveau 2,Il est renommé pour son intelligence. Son gros cerveau est un indicateur de la puissance de ses pouvoirs psychiques.,
827,8,Goupilou,Ténèbres,,,,Base,"Il vit en subtilisant la nourriture des autres Pokémon. Grâce à ses coussinets moelleux, il ne fait aucun bruit quand il marche.",
828,8,Roublenard,Ténèbres,,,,Niveau 1,"Grâce à son corps leste et ses griffes acérées, il va et vient en dérobant Œufs et nourriture. Son ennemi juré est Fulgudog. ",
829,8,Tournicoton,Plante,,,,Base,Nombreux sont ceux qui ont décidé d'en élever un après avoir été charmés par sa manière de chanter en virevoltant au gré de la brise.,
830,8,Blancoton,Plante,,,,Niveau 1,Les graines de son duvet sont remplies de nutriments. Elles sont emportées par le vent et redonnent vitalité aux plantes et aux Pokémon.,
831,8,Moumouton,Normal,,,,Base,Son pelage frisé est doux et rebondi comme un coussin. Une telle toison le protégerait même s'il chutait d'une falaise.,
832,8,Moumouflon,Normal,,,,Niveau 1,La texture de sa laine est si élastique que la surface des tapis fabriqués avec ce matériau est aussi rebondissante que celle d'un trampoline.,
833,8,Khélocrok,Eau,,,,Base,"La corne sur sa tête est aussi dure que la roche. Il s’en sert pour se battre et lorsque l’ennemi flanche, il le mord et ne le lâche plus.",
834,8,Torgamord,Eau,Roche,,,Niveau 1,"De nature très violente, il mord fermement ses proies avec sa mâchoire, assez puissante pour broyer une barre de fer.",
835,8,Voltoutou,Electrique,,,,Base,"Lorsqu'il court, on peut voir de l'électricité se former à la base de sa queue. Ce Pokémon est très populaire auprès des bergers de Galar.",
836,8,Fulgudog,Electrique,,,,Niveau 1,"Il produit de l'électricité puis la transfère dans ses pattes pour mieux courir. Ainsi, il peut foncer pendant trois jours et trois nuits.",
837,8,Charbi,Roche,,,,Base,On l'a découvert dans une mine il y a 400 ans. Son corps est presque entièrement composé d'une substance identique au charbon.,
838,8,Wagomine,Roche,Feu,,,Niveau 1,"Il produit du charbon dans son corps. Jadis, les habitants de Galar ramassaient ce charbon au sol et s'en servaient pour leurs besoins quotidiens.",
839,8,Monthracite,Roche,Feu,,,Niveau 2,"Il est d'une nature paisible, mais si les humains tentent de piller ses mines, il enrage et brûle tout avec des flammes à 1 500 ° C.",
840,8,Verpom,Plante,Dragon,,,Base,"Il vit toujours dans sa pomme. S'il croise un Pokémon oiseau, son prédateur naturel, il se fait passer pour un simple fruit pour se protéger.",
841,8,Pomdrapi,Plante,Dragon,,,Niveau 1,Il a évolué après avoir mangé une pomme acide. Il concentre dans ses joues un liquide si corrosif qu'il peut provoquer des brûlures.,
842,8,Dratatin,Plante,Dragon,,,Niveau 2,"Il a évolué après avoir mangé une pomme sucrée. Il attire ses proies, les Pokémon Insecte, en dégageant un parfum mielleux.",
843,8,Dunaja,Sol,,,,Base,Il amasse le sable qu'il avale en creusant dans la poche de son cou. Elle peut en contenir jusqu'à huit kilos.,
844,8,Dunaconda,Sol,,,,Niveau 1,"Il peut expulser 100 kg de sable de ses narines en compressant tout son corps. Quand il est à court de sable, il a tendance à se dérober.",
845,8,Nigosier,Vol,Eau,,3,Base,"Il est assez puissant pour terrasser un ennemi d'un seul coup, mais il est tellement nigaud qu'il oublie contre qui il se bat.",
846,8,Embrochet,Eau,,,,Base,Sa mâchoire fine et aiguisée fait sa fierté. À peine voit-il le moindre mouvement qu'il fonce dans sa direction.,
